<?xml version="1.0"?>
<xs:schema xmlns:xs="http://www.w3.org/2001/XMLSchema">
<xs:element name="Rezepte">
<xs:complexType>
<xs:sequence>
<xs:element name="Rezept" maxOccurs="unbounded" minOccurs="1">
<xs:complexType>
<xs:sequence>
	<xs:element name="Rezeptname" type="xs:string"/>
	<xs:element name="Autor" type="xs:string"/>

	<xs:element name="Zutaten" maxOccurs="1" minOccurs="1">
		<xs:complexType>
			<xs:sequence>
				<xs:element name="Zutat" maxOccurs="unbounded" minOccurs="1">
					<xs:complexType>
						<xs:sequence>
	                       <xs:element name="Name" type="xs:string" maxOccurs="1"
	                                   minOccurs="1"/>
	                       <xs:element name="Menge" type="xs:float" maxOccurs="1"
	                                   minOccurs="0"/>
	                   </xs:sequence>
	                   <xs:attribute name="Einheit" default="g">
	                       <xs:simpleType>
	                            <xs:restriction base="xs:string">
	                                <xs:enumeration value="g"/>
	                                <xs:enumeration value="Pck."/>
	                                <xs:enumeration value="EL"/>
	                                <xs:enumeration value="ml"/>
	                                <xs:enumeration value="Prise"/>
	                                <xs:enumeration value="Dose"/>
	                                <xs:enumeration value="TL"/>
	                                <xs:enumeration value="Pkt."/>
	                                <xs:enumeration value="Stk." />
	                                <xs:enumeration value="Flasche"/>
	                            </xs:restriction>
	                        </xs:simpleType>
	                    </xs:attribute>
	                </xs:complexType>
	            </xs:element>
	        </xs:sequence>
	    </xs:complexType>
	</xs:element>


	<xs:element name="Portionen">
		<xs:simpleType>
 		   <xs:restriction base="xs:integer">
      			<xs:minInclusive value="0"/>
      			<xs:maxInclusive value="20"/>
    		</xs:restriction>
  		</xs:simpleType>
	</xs:element>


	<xs:element name="Zubereitung">
		<xs:complexType>
			<xs:sequence>	
				<xs:element name="Arbeitszeit">
					<xs:complexType>
                          <xs:sequence>
                               <xs:element name="Dauer" type="xs:integer"/>
                         </xs:sequence>
                         <xs:attribute name="Einheit">
                             <xs:simpleType>
                                <xs:restriction base="xs:string">
                                        <xs:enumeration value="std"/>
										<xs:enumeration value="min"/>
								</xs:restriction>
							</xs:simpleType>                         
						</xs:attribute>
					</xs:complexType>
                </xs:element>
				<xs:element name="Schwierigkeitsgrad" type="xs:string"/>
				<xs:element name="Brennwert-p.P" type="xs:integer"/>
				<xs:element name="VorgÃ¤nge" type="xs:string"/>	
			</xs:sequence>
		</xs:complexType>
	</xs:element>
	<xs:element name="Kommentieren">
	<xs:complexType>	
		<xs:sequence>
	            <xs:element name="Kommentar">
	                <xs:complexType>
	                    <xs:attribute name="Name" type="xs:string"/>
	                    <xs:attribute name="Datum" type="xs:date"/>
	                    <xs:attribute name="Zeit" type="xs:time"/>
	                    <xs:attribute name="Kommentare" type="xs:string"/>
	                </xs:complexType>
	            </xs:element>
	        </xs:sequence>
	    </xs:complexType>
	</xs:element>
</xs:sequence>
</xs:complexType>
</xs:element>
</xs:sequence>
</xs:complexType>
</xs:element>
</xs:schema>